{
  "$schema": "../../schema/content-pack.schema.json",
  "pack_id": "draw-steel-core",
  "schema_id": "draw-steel",
  "name": "Draw Steel: Heroes (via Forge Steel)",
  "version": "1.0.0",
  "description": "Every class, subclass, ancestry and trait, culture, career, kit, domain, perk, title and complication from Draw Steel: Heroes, with each ability's power-roll tiers and each class's features by level. The text is MCDM's, converted from Forge Steel's data for the core book only.",
  "license": "Draw Steel Creator License",
  "license_url": "https://www.mcdmproductions.com/draw-steel-creator-license",
  "attribution": "This pack is an independent product published under the DRAW STEEL Creator License and is not affiliated with MCDM Productions, LLC. DRAW STEEL © 2024 MCDM Productions, LLC. Converted from the data of Forge Steel (https://github.com/andyaiken/forgesteel) by Andy Aiken.",
  "source_url": "https://forgesteel.net/",
  "source": "heroes"
}
