{
  "pack_id": "dnd-5e-srd",
  "schema_id": "dnd-5e-2024",
  "name": "D&D 5e SRD 5.2",
  "version": "2.0.0",
  "description": "The System Reference Document 5.2, and nothing outside it: classes and every class and subclass feature, species and their traits, backgrounds, feats, all 339 spells, equipment and magic items.",
  "license": "CC-BY-4.0",
  "license_url": "https://creativecommons.org/licenses/by/4.0/",
  "attribution": "This work includes material from the System Reference Document 5.2 (“SRD 5.2”) by Wizards of the Coast LLC, available at https://www.dndbeyond.com/srd. The SRD 5.2 is licensed under the Creative Commons Attribution 4.0 International License, available at https://creativecommons.org/licenses/by/4.0/legalcode.",
  "source_url": "https://www.dndbeyond.com/srd",
  "source": "srd"
}
