{
  "$schema": "../../schema/content-pack.schema.json",
  "pack_id": "pf2e-player-core",
  "schema_id": "pathfinder-2e",
  "name": "Pathfinder Player Core",
  "version": "1.0.0",
  "description": "The ancestries, heritages, backgrounds, classes, class features, feats and spells of Pathfinder Player Core (the remastered core rulebook), converted from the Pathfinder Second Edition system for Foundry VTT. ORC-licensed content from that one book only.",
  "license": "ORC",
  "license_url": "https://paizo.com/orclicense",
  "attribution": "ORC Notice: This product is licensed under the ORC License located at the Library of Congress at TX 9-307-067 and available online at various locations. All warranties are disclaimed as set forth therein. Attribution: This product is based on the following Licensed Material: Pathfinder Player Core © 2023, Paizo Inc.; Designers: Logan Bonner, Jason Bulmahn, Stephen Radney-MacFarland, and Mark Seifter. Authors: Alexander Augunas, Kate Baker, Logan Bonner, Jason Bulmahn, Carlos Cabrera, Calder CaDavid, James Case, Eleanor Ferron, Steven Hammond, Joan Hong, Vanessa Hoskins, James Jacobs, Jenny Jarzabski, Erik Keith, Dustin Knight, Lyz Liddell, Luis Loza, Patchen Mortimer, Dennis Muldoon, Stephen Radney-MacFarland, Mikhail Rekun, David N. Ross, Michael Sayre, Mark Seifter, Kendra Leigh Speedling, Mark Thompson, Clark Valentine, Andrew White, Landon Winkler, and Linda Zayas-Palmer. Reserved Material: Pathfinder and its trademarks are Paizo Inc.'s, and this pack is not published, endorsed, or specifically approved by Paizo Inc. Converted from the Pathfinder Second Edition system for Foundry Virtual Tabletop (https://github.com/foundryvtt/pf2e), whose code is licensed under the Apache License 2.0.",
  "source_url": "https://github.com/foundryvtt/pf2e",
  "source": "player-core"
}
